No,Harga,Desc,Lokasi,Tanah,Bangunan,Kamar,WC
1,"1,75 M","Rumah Mewah di Bandung Kota, Disc 300 jta, Fasilitas Lengkap, Soekarno Hatta, Bandung","Bandung, Soekarno Hatta",180,120,3,2
2,710000000,"Rumah Asri di Bandung Kota, CLUSTER ZINGONIUM, Grand sharon, Bandung Kota, Bandung","Bandung, Bandung Kota",72,42,2,1
3,"1,1 M","Rumah minimalis modern di bandung kota Diskon 300 juta, Soekarno Hatta, Bandung","Bandung, Soekarno Hatta",95,85,3,2
4,"1,12 M","rumah minimalis 2 lantai di Cluster Estillo Grand Sharon Residence Bandung Timur, Soekarno Hatta, Bandung","Bandung, Soekarno Hatta",95,82,3,2
5,710000000,"Rumah Mewah di cluster Ekslusif di bandung Timur, Bandung Kota, Bandung","Bandung, Bandung Kota",72,42,2,1
6,930000000,"Rumah Mewah di bandung Timur Diskon 300 juta Gratis Taman, Soekarno Hatta, Bandung","Bandung, Soekarno Hatta",109,52,2,1
7,980000000,"Ruamah idaman di bandung Timur dilengkapi taman tematik, Soekarno Hatta, Bandung","Bandung, Soekarno Hatta",123,52,2,1
8,1 M,"Promo Dp 0%, Akses Jalan Dekat Main Road Soekarno Hatta Bandung, Soekarno Hatta, Bandung","Bandung, Soekarno Hatta",109,68,2,1
9,"2,9 M","Rumah Mewah Dekat RS Al-Islam, Siap Huni, Diskon Dp 50%, Bebas Biaya KPR&amp;Pajak, Ada Kolam Renang dan Lapangan2 Olahraga, Soekarno Hatta, Bandung","Bandung, Soekarno Hatta",225,175,5,3
10,"1,82 M","Rumah Siap Huni Diskon Dp 50% Bisa Dicicil, Free Biaya KPR, dan Bonus CCTV, Soekarno Hatta, Bandung","Bandung, Soekarno Hatta",180,120,3,2
11,"1,15 M","Rumah Siap Huni Di Bandung Timur Soekarno Hatta, Ada Kolam Renang, Bebas Banjir, Soekarno Hatta, Bandung","Bandung, Soekarno Hatta",95,82,3,2
12,"2,9 M","Rumah Mewah Siap Huni, Diskon Dp 50% Bisa Dicicil, Free Biaya KPR, Soekarno Hatta, Bandung","Bandung, Soekarno Hatta",225,175,5,3
13,1 M,"Rumah Dekat RS al-Islam Bandung, Dp Mulai 30jutaan Lebih, Bebas Biaya KPR, Soekarno Hatta, Bandung","Bandung, Soekarno Hatta",82,95,3,2
14,"1,8 M","Rumah Mewah Di Bandung Timur, Diskon DP 50% Bisa Dicicil, Free Biaya KPR, Soekarno Hatta, Bandung","Bandung, Soekarno Hatta",180,120,3,2
15,"2,93 M","Rumah yang Siap Huni Di Bandung Timur, Ada Fasilitas Kolam Renang dan Sarana Lain, Soekarno Hatta, Bandung","Bandung, Soekarno Hatta",225,175,3,2
16,380000000,"Rumah Villa Dp 20juta, Cicilan 3jt, Lokasi Strategis di Bandung Timur, Cileunyi, Bandung","Bandung, Cileunyi",75,40,2,1
17,750000000,"Rumah Siap Huni Dp 30jt-an Bisa Dicicil, Free Biaya KPR, Bonus Canopy Depan, Soekarno Hatta, Bandung","Bandung, Soekarno Hatta",78,45,2,1
18,725000000,"rumah cluster belleza, Antapani, Bandung","Bandung, Antapani",104,110,3,3
19,465000000,"Rumah Siap Huni Kota Bandung Timur, Ujungberung, Bandung","Bandung, Ujungberung",73,36,2,1
20,814000000,"Rumah Baru di kota Bandung DP Ringan, Ciwastra, Bandung","Bandung, Ciwastra",90,45,2,1
21,675000000,"Rumah minimalis baru, 2 lantai 900 meter dari Jl. PH mustofa, Cicaheum, Bandung","Bandung, Cicaheum",60,66,2,2
22,698000000,"Rumah Murah Kota Bandung DP Ringan, Ciwastra, Bandung","Bandung, Ciwastra",90,40,2,1
23,710000000,"Clsuter Baru Fasilitas Terlengkap Grand Sharon, Soekarno Hatta, Bandung","Bandung, Soekarno Hatta",72,42,2,1
24,"1,01 M","Rumah Minimalis Fasilitas terlengkap Grand sharon, Soekarno Hatta, Bandung","Bandung, Soekarno Hatta",108,52,2,1
25,345000000,"Cluster Syariah Baru Eksklusif Bandung Timur Pas 300 Jt, Ujungberung, Bandung","Bandung, Ujungberung",36,72,2,1
26,"1,1 M","Rumah Taman di Grand sharon Bandung Selatan, Soekarno Hatta, Bandung","Bandung, Soekarno Hatta",68,109,2,1
27,"2,96 M","Luxury Home at Grand Sharon Bandung ... PROMO!!!!, Soekarno Hatta, Bandung","Bandung, Soekarno Hatta",225,175,5,3
28,376000000,"Promo Besar2an Cluster Eksklusif Bandung timur dekat Ext Tol Cileunyi, Rancaekek, Bandung","Bandung, Rancaekek",86,36,2,1
29,"1,16 M","Clsuter Minimalis 2 Lantai di Grand Sharon Promo Terbatas, Soekarno Hatta, Bandung","Bandung, Soekarno Hatta",95,82,3,2
30,337000000,"Cluster Murah Baru Bandung Timur dekat Exit Tol Cileunyi, Rancaekek, Bandung","Bandung, Rancaekek",72,36,2,1
31,"1,92 M","Promo Rumah Mewah di Grand sharon Kota Bandung, Soekarno Hatta, Bandung","Bandung, Soekarno Hatta",180,120,3,2
32,"1,4 M","Rumah di haruman bandung timur, Lengkong, Bandung","Bandung, Lengkong",166,180,3,2
33,"1,08 M","**Rumah cluster di bandung timur, Bandung Kota, Bandung","Bandung, Bandung Kota",120,115,3,2
34,600000000,"Rumah second di cicaheum bandung, Bandung Kota, Bandung","Bandung, Bandung Kota",72,36,2,1
35,780000000,"Rumah 2 lantai 900mtr dri jl. Phh. Mustofa view kota bandung, Cimenyan, Bandung","Bandung, Cimenyan",72,66,2,2
36,"1,92 M","Rumah 2lnt lokasi cipamokolan sebelah margahayu bandung disc 100jt, Bandung Kota, Bandung","Bandung, Bandung Kota",180,120,3,2
37,900000000,"Rumah 2 lantai di metro Margahayu harga dibawah pasaran, Rancasari, Bandung","Bandung, Rancasari",144,170,4,3
38,380000000,"Rumah villa di cileunyi dekat kawasan pendidikan jatinangor murah sisa 20unit, Cileunyi, Bandung","Bandung, Cileunyi",72,40,2,1
39,950000000,"Rumah view kota bandung di sindanglaya bandung timur, Mandalajati, Bandung","Bandung, Mandalajati",140,130,2,1
40,"1,66 M","Rumah hook lokasi di dekat margahayu metro disc. 150jt, Rancasari, Bandung","Bandung, Rancasari",183,76,3,1
41,"71,046,000,000","Rumah cluster modern dekat margahayu raya spek ats hatta discount dp 50%, Rancasari, Bandung","Bandung, Rancasari",72,42,2,1
42,"2,95 M","Rumah 2 lantai di rancasari cipamokolan bypass discount 50jt, Rancasari, Bandung","Bandung, Rancasari",225,175,4,3
43,750000000,"Villa di cileunyi sisa 3 kavling dekat kawasan pendidikan jatinangor, Cileunyi, Bandung","Bandung, Cileunyi",117,68,3,2
44,935000000,"nyari rumah keredit mewah dp 25 jtn di ciwatra kota bandung, Bandung Kota, Bandung","Bandung, Bandung Kota",96,70,2,1
45,"2,96 M","Rumah mewah siap huni diskon harga di rancasari bandung, Rancasari, Bandung","Bandung, Rancasari",225,175,,
46,858000000,"Cari rumah minimalis murah bisa keredit di kota bandung, Ciwastra, Bandung","Bandung, Ciwastra",105,54,,
47,"1,9 M","Hunian nyaman idaman keluarga di kawasan timur kota bandung, Soekarno Hatta, Bandung","Bandung, Soekarno Hatta",180,120,2,1
48,"1,25 M","Rumah asri mewah DP 25 juta lokasi paling sterategis di bandung kota, Ciwastra, Bandung","Bandung, Ciwastra",128,90,,
49,"1,15 M","RUMAH MEWAH & UNIK DI GRAND SHARON RESIDENCE KOTA BANDUNG, Soekarno Hatta, Bandung","Bandung, Soekarno Hatta",95,82,2,1
50,"70,218,000,000","Rumah cantik dan mewah lokasi paling exsklusif di soekarno hata bandung, Soekarno Hatta, Bandung","Bandung, Soekarno Hatta",72,42,1,1
51,"1,09 M","Rumah minimalis DP 0 % murah d soekarno-hata bandung timur, Soekarno Hatta, Bandung","Bandung, Soekarno Hatta",109,68,2,
52,"70,218,000,000","Rumah idaman siap huni di bandung timur, Bandung Kota, Bandung","Bandung, Bandung Kota",72,42,2,1
53,"1,9 M","Rumah impian mewah lokasi paling beken hanya di bandung teknopolis, Soekarno Hatta, Bandung","Bandung, Soekarno Hatta",180,120,1,1
54,"99,888,000,000","Rumah impian cantik alami lokasi strategis 5 menit ke tol gede bage bandung, Rancasari, Bandung","Bandung, Rancasari",108,52,,
55,702000000,"Rumah type brio zingonium diskon 150 jta diskon DP pree kpr d bandung timur, Soekarno Hatta, Bandung","Bandung, Soekarno Hatta",72,42,,
56,"2,9 M","Rumah minimalis Exclusive di kota bandung hunian nyaman keluarga, Rancasari, Bandung","Bandung, Rancasari",225,175,2,1
57,"1,15 M","Rumah mewah impian keluarga paling exclusive di bandung timur, Soekarno Hatta, Bandung","Bandung, Soekarno Hatta",93,82,1,
58,700000000,"Miliki rumah impian keluarga di grand sharon residence bandung timur, Rancasari, Bandung","Bandung, Rancasari",72,42,1,1
59,990000000,"Rumah cantik dan exclusive lokasi paling strategis 5 menit ke tol gedebage bandung, Bandung Kota, Bandung","Bandung, Bandung Kota",112,52,2,1
60,"2,75 M","Rumah 2 lantai full furnish full kayu ulin dan jati, Ujungberung, Bandung","Bandung, Ujungberung",327,350,7,3
61,"2,3 M","Rumah 2 lantai hook di kompleks Cipaganti Dream Land AH Nasution, Ujungberung, Bandung","Bandung, Ujungberung",218,400,6,3
62,800000000,"Rumah Renovasi di Pinus Regency Soekarno Hatta, Soekarno Hatta, Bandung","Bandung, Soekarno Hatta",90,70,2,2
63,"1,2 M","rumah lokasi strategis bandung timur, Cicaheum, Bandung","Bandung, Cicaheum",108,75,3,3
64,675000000,"rumah minimalis udara sejuk dekat kampus bebas banjir dikota bandung, Cimenyan, Bandung","Bandung, Cimenyan",60,66,2,2
65,670000000,"rumah murah dikota bandung dekat universitas bebas banjir dekat terminal, Padasuka, Bandung","Bandung, Padasuka",60,66,2,2
66,760000000,"rumah cantik view bandung sejuk  dan asri dikota bandung bebas banjir, Padasuka, Bandung","Bandung, Padasuka",60,66,2,2
67,675000000,"rumah dibandung udara sejuk bebas banjir dekat terminal dan kampus pasar, Cimenyan, Bandung","Bandung, Cimenyan",60,66,2,2
68,900000000,"rumah cantik cigantiri bandung, Bandung Wetan, Bandung","Bandung, Bandung Wetan",118,116,3,2
69,750000000,"rumah siap huni ciwastra bandung dekat tol buah batu, Ciwastra, Bandung","Bandung, Ciwastra",142,100,4,2
70,790000000,"Rumah Lantai 2 di Arcamanik Cisaranten Kulon Kota Bandung, Arcamanik, Bandung","Bandung, Arcamanik",800,82,3,2
71,550000000,"Rumah Minimalis, Rumah Cantik di Bandung, Cisaranten Kulon, Kav Geologi, Arcamanik, Arcamanik, Bandung","Bandung, Arcamanik",90,45,2,1
72,350000000,"RUMAH CANTIK LINGKUNGAN NYAMAN DAN ASRI DI CIBIRU HILIR BANDUNG, Cibiru, Bandung","Bandung, Cibiru",84,45,2,1
73,440000000,"Rumah minimalis harga murah di Bandung, Ujungberung, Bandung","Bandung, Ujungberung",92,45,2,1
74,600000000,"Rumah minimalis, Rumah Murah,  Baru Ready siap huni di Cijambe Bandung Timur, Cicaheum, Bandung","Bandung, Cicaheum",70,60,2,1
75,440000000,"Rumah minimalis harga murah di Ujung Berung Bandung, Ujungberung, Bandung","Bandung, Ujungberung",92,45,2,1
76,790000000,"2 Unit Rumah, Rumah Baru Lantai 2, Rumah Murah Di Arcamanik Bandung, Arcamanik, Bandung","Bandung, Arcamanik",80,82,3,2
77,380000000,"Cluster Cantik Nuansa Villa di Jatinangor Dkt Kaw Kampus, Jatinangor, Sumedang","Sumedang, Jatinangor",72,40,2,1
78,380000000,"Hunian Asri Nuansa Villa Dkt Kampus Jatinangor, Cilenyi, One Gate, Cileunyi, Bandung","Bandung, Cileunyi",72,40,2,1
79,380000000,"Cluster Nuansa Villa Dkt Itb, Unpad JtNangor, 10Mnt Tol Cilenyi, One Gate, Ujungberung, Bandung","Bandung, Ujungberung",72,40,2,1
80,"69,883,000,000","Rumah Asri Strategis di kota Bandung, Ciwastra, Bandung","Bandung, Ciwastra",90,40,2,1
81,425000000,"Rumah Minimalis Baru di Pasir Jati, Ujungberung, Bandung","Bandung, Ujungberung",72,45,2,1
82,"1,9 M","Rumah mewah di Bandung timur dekat RS Al-Islam Ready Stock, Bandung Kota, Bandung","Bandung, Bandung Kota",180,120,4,2
83,"4,5 M","Rumah strategis dan nyaman di Arcamanik Bandung Timur, Arcamanik, Bandung","Bandung, Arcamanik",440,400,3,4
84,830000000,"Rumah minimalis di Antapani Bandung Timur, Antapani, Bandung","Bandung, Antapani",110,90,3,2
85,"4,3 M","Rumah Cantik di Arcamanik Bandung Timur, Arcamanik, Bandung","Bandung, Arcamanik",400,270,8,4
86,760000000,"Rumah cantik dan terawat di Arcamanik Bandung Timur, Arcamanik, Bandung","Bandung, Arcamanik",120,87,3,2
87,630000000,"Rumah baru cantik di Cingised Arcamanik Bandung Timur, Arcamanik, Bandung","Bandung, Arcamanik",86,36,2,1
88,3 M,"Rumah cantik strategis di Golf Arcamanik Bandung Timur, Arcamanik, Bandung","Bandung, Arcamanik",411,500,5,4
89,"2,9 M","Rumah Mewah dan Strategis dekat Rs. Al Islam di Bandung Timur, Soekarno Hatta, Bandung","Bandung, Soekarno Hatta",225,175,3,3
90,"1,48 M","Rumah strategis bonus furniture di Antapani kidul Bandung Timur, Antapani, Bandung","Bandung, Antapani",89,150,3,3
91,4 M,"Rumah cantik strategis banget di Cisaranten Arcamanik Bandung Timur, Arcamanik, Bandung","Bandung, Arcamanik",500,510,6,3
92,770000000,"Rumah cantik minimalis di Arcamanik Bandung Timur, Antapani, Bandung","Bandung, Antapani",90,54,2,1
93,"1,37 M","Rumah nyaman 3 Lantai di Giri Mekar Ujung Berung Bandung Timur, Ujungberung, Bandung","Bandung, Ujungberung",120,200,4,3
94,"1,65 M","Rumah nyaman aari dan minimalis di Arcamanik Bandung Timur, Arcamanik, Bandung","Bandung, Arcamanik",200,145,5,2
95,"1,65 M","Rumah minimalis cantik di Arcamanik Bandung Timur, Arcamanik, Bandung","Bandung, Arcamanik",200,145,5,2
96,"1,1 M","Rumah Mewah di Soekarno-Hatta Bandung Timur, Soekarno Hatta, Bandung","Bandung, Soekarno Hatta",95,82,3,2
97,545000000,"Rumah murah di Jatinangor Bandung Timur, Jatinangor, Bandung","Bandung, Jatinangor",75,40,2,1
98,"3,2 M","Rumah cantik di Antapani Bandung Timur, Antapani, Bandung","Bandung, Antapani",200,250,4,4
99,560000000,"Rumah baru murah di Cingised Arcamanik Bandung Timur Bonus Kitcen set dan AC, Arcamanik, Bandung","Bandung, Arcamanik",90,45,2,1
100,"1,74 M","Rumah cantik 2 lantai di Antapani Bandung Timur, Antapani, Bandung","Bandung, Antapani",128,170,4,2
101,800000000,"Rumah nyaman di Ciwastra Bandung Timur, Ciwastra, Bandung","Bandung, Ciwastra",105,60,3,2
102,970000000,"Rumah nyaman 2 lantai di Arcamanik Town House Bandung Timur, Arcamanik, Bandung","Bandung, Arcamanik",84,124,4,2
103,"1,35 M","Rumah mewah di Cisaranten kulon Arcamanik Bandung Timur, Arcamanik, Bandung","Bandung, Arcamanik",200,180,4,3
104,"3,2 M","Rumah pinggir jalan sangat strategis di Cileunyi Bandung Timur, Cileunyi, Bandung","Bandung, Cileunyi",206,366,8,5
105,"1,8 M","Rumah mewah di Bandung timur dekat RS Al-Islam Ready Stock, Bandung Kota, Bandung","Bandung, Bandung Kota",180,120,4,2
106,690000000,"Rumah Siap Huni Di Bandung Timur Grand Sharon Residence, Soekarno Hatta, Bandung","Bandung, Soekarno Hatta",72,42,2,1
107,"1,8 M","Rumah mewah di Bandung timur dekat RS Al-Islam Ready Stock, Bandung Kota, Bandung","Bandung, Bandung Kota",180,120,4,2
108,"1,8 M","Rumah mewah di Bandung timur dekat RS Al-Islam Ready Stock, Bandung Kota, Bandung","Bandung, Bandung Kota",180,120,4,2
109,570000000,"Rumah murah di Cisaranten Arcamanik Bandung Timur, Arcamanik, Bandung","Bandung, Arcamanik",95,60,2,1
110,850000000,"Rumah 2 Lantai murah lagi BU di Cileunyi Bandung Timur, Cileunyi, Bandung","Bandung, Cileunyi",188,217,4,2
111,"1,8 M","Rumah mewah di Bandung timur dekat RS Al-Islam Ready Stock, Bandung Kota, Bandung","Bandung, Bandung Kota",180,120,4,2
112,"1,8 M","Rumah mewah di Bandung timur dekat RS Al-Islam Ready Stock, Bandung Kota, Bandung","Bandung, Bandung Kota",180,120,4,2
113,"1,8 M","Rumah mewah di Bandung timur dekat RS Al-Islam Ready Stock, Bandung Kota, Bandung","Bandung, Bandung Kota",180,120,4,2
114,998000000,"Rumah strategis di Bandung Timur, Soekarno Hatta, Bandung","Bandung, Soekarno Hatta",108,52,2,1
115,350000000,"Rumah murah Nuansa Villa di Bandung Timur, Cileunyi, Bandung","Bandung, Cileunyi",72,40,2,1
116,350000000,"Rumah murah Bernuansa Villa di Bandung Timur dekat Tol Cilenyi, Cileunyi, Bandung","Bandung, Cileunyi",72,40,2,1
117,"1,8 M","Rumah Mewah dekat Pusat Kota Bandung Timur, Soekarno Hatta, Bandung","Bandung, Soekarno Hatta",180,120,3,2
118,3 M,"Rumah Belanda Dekat Jalan Supratman Bandung, Bandung Kota, Bandung","Bandung, Bandung Kota",264,210,7,4
119,850000000,"rumah nyaman di arcamanik,Bandung, Arcamanik, Bandung","Bandung, Arcamanik",150,75,2,1
120,1 M,"rumah nyaman di Arcamanik ,Bandung Timur, Arcamanik, Bandung","Bandung, Arcamanik",166,88,2,2
121,790000000,"rumah baru modern di arcamanik,Bandung, Arcamanik, Bandung","Bandung, Arcamanik",80,82,3,2
122,545000000,"CLUSTERS ADIPURA GEDEBAGE HARGA WAJAR, Gede Bage, Bandung","Bandung, Gede Bage",65,90,2,1
123,950000000,"Rumah di cluster Pondok Mas, Baros, Cimahi, Cimahi Selatan, Cimahi","Cimahi, Cimahi Selatan",112,67,2,1
124,999000000,"RUMAH TENANG NAN LUAS  DI KOMPLEK ELIT  BANDUNG TIMUR, Cicaheum, Bandung","Bandung, Cicaheum",175,185,4,2
125,400000000,"cluster ..nyaman di cibiru dekat upi, Cibiru, Bandung","Bandung, Cibiru",80,70,2,1
126,365000000,"rumah murah di bandung timur dekat margahayu, Rancasari, Bandung","Bandung, Rancasari",60,50,2,1
127,750000000,"Rumah murah ujung berung, Rumah Minimalis 2 lantai Bandung Timur, Ujungberung, Bandung","Bandung, Ujungberung",75,107,3,2
128,650000000,"turun harga Cluster nyaman dekat unpad jatinangor dan tol cileunyi, Cileunyi, Bandung","Bandung, Cileunyi",112,100,4,2
129,450000000,"cluster harga wajar dekat summarecon gedebage, Gede Bage, Bandung","Bandung, Gede Bage",60,40,2,1
130,"2,3 M","RUMAH TUK USAHA DI DEKAT GRIYA ANTAPANI, Antapani, Bandung","Bandung, Antapani",180,180,5,2
131,"1,7 M","KOST2N AKTIF DI JATINAGOR UNPAD, Jatinangor, Sumedang","Sumedang, Jatinangor",245,266,15,15
132,380000000,"Rumah KPR Sindanglaya Bandung Timur, Ujungberung, Bandung","Bandung, Ujungberung",72,36,2,1
133,725000000,"RUMAH MINIMALIS ANTAPANI, JALAN 2 MOBIL Harga 725 Jt, Antapani, Bandung","Bandung, Antapani",71,110,4,2
134,650000000,"Jarang Ada...siap Huni  Dekat Jalur Angkot, Ujungberung, Bandung","Bandung, Ujungberung",101,45,2,1
135,650000000,"DI OBRAL RUMAH LUAS LOKASI BERKEMBANG DI ARCAMANIK, Arcamanik, Bandung","Bandung, Arcamanik",200,45,2,1
136,800000000,"Rumah Baru Minimalis di Komplek Propelat Samping Komplek Margahayu Raya, Ciwastra, Bandung","Bandung, Ciwastra",98,85,2,1
137,800000000,"RUMAH BARU 2 Lantai  di Komplek Propelat DEKAT Komp. Margahayu Raya, Margahayu, Bandung","Bandung, Margahayu",98,85,2,1
138,475000000,"Rumah ujung berung Bandung Timur, di Pesanggrahan Sekemala Type 45/92, Ujungberung, Bandung","Bandung, Ujungberung",92,45,2,1
139,825000000,"Rumah murah di Komplek Bandung Indah Raya, Ciwastra, Bandung","Bandung, Ciwastra",130,75,3,2
140,399000000,"Rumah baru di rancaekek, 2 Km ke Tol Cileunyi, Rancaekek, Bandung","Bandung, Rancaekek",78,45,2,1
141,349000000,"Rumah di rancaekek, Dekat Rancaekek Trade Mall, Rancaekek, Bandung","Bandung, Rancaekek",72,36,2,1
142,2 M,"Rumah murah margahayu raya, Lux dan Strategis, Rancabolang Indah, Margahayu, Bandung","Bandung, Margahayu",296,260,5,5
143,825000000,"Rumah di Perumahan Bandung Indah Raya Riung Bandung Timur, Soekarno Hatta, Bandung","Bandung, Soekarno Hatta",75,130,3,2
144,825000000,"Rumah di riung bandung cipamokolan, Komplek Bandung Indah Raya, Rancasari, Bandung","Bandung, Rancasari",75,130,3,2
145,700000000,"Rumah di arcamanik bandung, 400 meter ke Griya Arcamanik, Antapani, Bandung","Bandung, Antapani",80,60,2,1
146,700000000,"Rumah nyaman asri siap huni area arcamanik Bandung, Arcamanik, Bandung","Bandung, Arcamanik",80,60,2,1
147,"2,7 M","Rumah Mewah 2 muka selatan, utara Desain Romawi di Ujungberung, Ujungberung, Bandung","Bandung, Ujungberung",190,107,5,2
148,1 M,"Rumah Siap Huni dan Strategi di Kawaluyaan Taman Raflesia MURAH, Soekarno Hatta, Bandung","Bandung, Soekarno Hatta",157,150,4,2
149,975000000,"Rumah daerah soekarno hatta bandung, Komplek Elite GREEN SHARON Residence, Soekarno Hatta, Bandung","Bandung, Soekarno Hatta",130,55,2,1
150,475000000,"Rumah cibiru hilir bandung, Strategis, Aman dan Nyaman Siap HUNI, Cibiru, Bandung","Bandung, Cibiru",84,70,2,1
151,"1,85 M","Rumah di komplek sukaasih, Luas bisa dijadikan Kantor, Ujungberung, Bandung","Bandung, Ujungberung",328,250,6,4
152,650000000,"Rumah terusan buah batu, Graha Ciganitri Bandung Timur, Sudah RENOVASI, Buah Batu, Bandung","Bandung, Buah Batu",114,120,3,2
153,"1,5 M","Rumah minimalis di Sindanglaya Ujungberung bandung timur, Ujungberung, Bandung","Bandung, Ujungberung",240,180,5,3
154,"2,2 M","Rumah Nyaman, Tanah Luas di Komplek Sanggar Hurip Dekat  RS Al-Islam Soekarno Hatta, Soekarno Hatta, Bandung","Bandung, Soekarno Hatta",300,100,3,2
155,825000000,"Rumah Besar, Nyaman, Strategis, Komplek Adipura Gedebage Bandung, Gede Bage, Bandung","Bandung, Gede Bage",119,100,3,2
156,"1,6 M","Rumah murah di margahayu raya bandung, Jalan Merkuri raya dekat METRO, Margahayu, Bandung","Bandung, Margahayu",221,250,6,3
157,780000000,"Cluster Green Puti Residence @ Cimuncang-Bandung Timur, Serasa Tinggal di Villa, Cicaheum, Bandung","Bandung, Cicaheum",72,66,2,2
158,"1,97 M","Rumah Mewah di Kawasan Boulevard Bandung Timur,dkt RS AL ISLAM, Batununggal, Bandung","Bandung, Batununggal",180,120,3,2
159,"1,16 M","Rumah Modern Townhouse Estillo di Kawasan Elit Bandung Timur, Soekarno Hatta, Bandung","Bandung, Soekarno Hatta",95,82,3,2
160,"2,96 M","Rumah Mewah Ekslusive Di Kawasan Elit dkt METRO Bandung Timur, Bandung Kota, Bandung","Bandung, Bandung Kota",225,175,3,3
161,"97,825,000,000","hanya 15 menit ke pusat kota cimahi, orchard residence, Cimahi Utara, Cimahi","Cimahi, Cimahi Utara",120,65,3,2
162,"97,825,000,000","orchard residence, berdampingan dengan alam wisata cimahi, Cimahi Utara, Cimahi","Cimahi, Cimahi Utara",120,65,3,2
163,"97,825,000,000","orchard residence cimahi, konsep rumah villa modern minimalis, Cimahi Utara, Cimahi","Cimahi, Cimahi Utara",72,36,3,2
164,395000000,"RUMAH PALING MURAH DI CIWASTRA DENGAN BANGUNAN KOKOH BARU RENOVASI, Ciwastra, Bandung","Bandung, Ciwastra",96,80,2,1
165,700000000,"BUTUH RUMAH MURAH DI BANDUNG TIMUR UJUNG BERUNG, Ujungberung, Bandung","Bandung, Ujungberung",112,65,2,1
166,625000000,"CARI RUMAH MURAH DI BANDUNG TIMUR ARCAMANIK, Arcamanik, Bandung","Bandung, Arcamanik",96,50,3,1
167,450000000,"RUMAH MINIMALIS SIAP HUNI DI UJUNG BERUNG, Ujungberung, Bandung","Bandung, Ujungberung",78,55,2,1
168,450000000,"RUMAH MINIMALIS SIAP HUNI DI UJUNG BERUNG, Ujungberung, Bandung","Bandung, Ujungberung",84,45,2,1
169,4 M,"Rumah Villa Mewah Kayu Jati Asli View Kota Bandung, Ujungberung, Bandung","Bandung, Ujungberung",1660,500,5,5
170,4 M,"Rumah Villa Mewah Kayu Jati Asli View Kota Bandung Indah, Bandung Kota, Bandung","Bandung, Bandung Kota",1660,500,5,5
171,349000000,"Rumah murah Bandung Timur tanpa bunga, Cilengkrang, Bandung","Bandung, Cilengkrang",84,45,3,1
172,385000000,"Rumah murah di Bandung Timur tanpa denda tanpa sita, Cilengkrang, Bandung","Bandung, Cilengkrang",90,45,3,1
173,960000000,"Ruko akses mainroad pasti untung, Ruko di Rancaekek, Cicalengka, Bandung","Bandung, Cicalengka",70,140,2,2
174,"1,1 M","Kosan Aktif 10 kamar di Babakansari Kiaracondong Bandung, Kiaracondong, Bandung","Bandung, Kiaracondong",112,138,10,5
175,450000000,"rumah idaman keluarga bebas banjir dan dekat kawasan bisnis ciwastra bandung timur, Ciwastra, Bandung","Bandung, Ciwastra",84,36,2,1
176,"1,75 M","rumah di kembar bandung tengah harga bandung timur, BKR, Bandung","Bandung, BKR",182,156,3,2
177,350000000,"Rumah adem mantaf, Cilengkrang, Bandung","Bandung, Cilengkrang",108,90,3,2
178,2 M,"rumah komplek citra antapani yang strategis, Antapani, Bandung","Bandung, Antapani",245,100,2,1
179,2 M,"rumah komplek citra lokasi strategis antapani bandung, Antapani, Bandung","Bandung, Antapani",230,100,2,1
180,"1,95 M","jarang ada vila antapani indah yang strategis, Antapani, Bandung","Bandung, Antapani",154,220,3,3
181,780000000,"Rumah Mewah 2lantai Murah di Cimuncang Padasuka Bandung, Bandung Kota, Bandung","Bandung, Bandung Kota",72,66,2,2
182,731000000,"Rumah Cantik di Kawasan Elit Grand Sharon Bandung Timur, Bandung Kota, Bandung","Bandung, Bandung Kota",72,42,2,1
183,315000000,"Woowww...Rumah Murah 300jt an di Bandung Timur selangkah dari Tol Gedebage, Bandung Kota, Bandung","Bandung, Bandung Kota",60,60,1,1
184,380000000,"Rumah Minimalis Serasa Villa di Bandung Timur dekat Unpad Jatinangor, Cileunyi, Bandung","Bandung, Cileunyi",72,42,2,1
185,"1,85 M","Rumah Asri & Luas,  di Bandung. (Ruby. 08159463846), Cimahi Selatan, Cimahi","Cimahi, Cimahi Selatan",328,250,6,4
186,"1,33 M","Rumah Cantik, Lux Minimalis, di Cibiru atas, Bandung Timur. (ruby. 08159463846), Cibiru, Bandung","Bandung, Cibiru",227,250,5,4
187,350000000,"Rumah type 45, di Cibiru Bandung, Cibiru, Bandung","Bandung, Cibiru",84,45,2,1
188,885000000,"Rumah di Ciwastra, Bandung Timur., Ciwastra, Bandung","Bandung, Ciwastra",125,100,2,2
189,"1,6 M","Rumah Second Komplek Saibi Melong Asih Cijerah Dekat Pusat Kota Bandung, Cijerah, Bandung","Bandung, Cijerah",163,200,4,3
190,731000000,"Hunian Terbaik di Soekarno Hatta Dkt Margahayu Raya, Fasilitas Oke, Buah Batu, Bandung","Bandung, Buah Batu",72,42,2,1
191,600000000,"Hunian Asri Nuansa Villa di Arcamanik, Aman Nyaman, Antapani, Bandung","Bandung, Antapani",87,36,2,2
192,731000000,"Hunian Terbaik di Bandung Timur Dapat Piagam Green Award, Dkt Margahayu, Fasilitas Oke, Antapani, Bandung","Bandung, Antapani",72,42,2,1
193,595000000,"Hunian Asri di Arcamanik, Strategis Aman Nyaman, Arcamanik, Bandung","Bandung, Arcamanik",87,36,2,2
194,"3,7 M","Rumah murah & besar 1,5 lantai di arcamanik, Dalam komplek dekat supermarket & bebas banjir, Arcamanik, Bandung","Bandung, Arcamanik",270,400,7,4
195,"1,5 M","Rumah Mewah di Bandung, Cileunyi, BUTUH UANG, FULL FURNISHED, Cileunyi, Bandung","Bandung, Cileunyi",119,336,4,2
196,"1,5 M","Rumah Mewah Murah di Bandung, BUTUH UANG, FULL FURNISHED, Cileunyi, Bandung","Bandung, Cileunyi",119,336,4,2
197,"1,5 M","Rumah Mewah Butuh Uang Segera, FULL FURNISHED, Cileunyi, Bandung","Bandung, Cileunyi",120,336,4,2
198,"1,5 M","Rumah Mewah Murah di Bandung, Cileunyi, Full Furnished, Udara Sejuk, Nyaman, Asri, Cileunyi, Bandung","Bandung, Cileunyi",119,336,4,2
199,"1,5 M","Rumah Mewah di Bandung, Cileunyi, Butuh Uang FULL FURNISHED, Cileunyi, Bandung","Bandung, Cileunyi",119,336,4,2
200,"1,5 M","Butuh Uang Segera, Rumah Mewah FULL FURNISHED, di Bandung Cileunyi, Cileunyi, Bandung","Bandung, Cileunyi",120,336,4,2
201,"1,5 M","Rumah Mewah Bandung, Cileunyi, Butuh Uang, FULL FURNISHED, Cileunyi, Bandung","Bandung, Cileunyi",119,336,4,2
202,"1,5 M","Rumah Mewah Bandung, Butuh Uang Segera, FULL FURNISHED, Cileunyi, Bandung","Bandung, Cileunyi",119,336,4,2
203,"1,5 M","Rumah Mewah Murah di Bandung, Cileunyi, BU, 1,5 M, FULL FURNISHED, Cileunyi, Bandung","Bandung, Cileunyi",120,336,4,2
