No,Harga,Desc,Lokasi,Tanah,Bangunan,Kamar,WC
1841,900000000,"Rumah minimalis lingkungan kuldesak di antapani, Antapani, Bandung","Bandung, Antapani",120,65,2,2
1842,985000000,"Rumah kokoh dan terawat di arcamanik, Arcamanik, Bandung","Bandung, Arcamanik",176,120,3,2
1843,"1,2 M","Rumah asri posisi Hook  5 menit ke Jalan AH Nasution, Arcamanik, Bandung","Bandung, Arcamanik",128,180,4,2
1844,"1,4 M","Rumah Mewah Harga Murah di Grand Sharon Bandung Timur, Gede Bage, Bandung","Bandung, Gede Bage",152,98,3,2
1845,"4,5 M","Rumah Super Mewah di Komp.Arcamanik, Arcamanik, Bandung","Bandung, Arcamanik",400,700,6,6
1846,"2,3 M","Rumah Mewah di Komp.Ellite Cileunyi Bandung Timur, Cileunyi, Bandung","Bandung, Cileunyi",710,570,5,5
1847,"1,4 M","Rumah Mewah Harga Murah di Grand Sharon Bandung Timur, Soekarno Hatta, Bandung","Bandung, Soekarno Hatta",152,98,3,2
1848,3 M,"Rumah Luas di Cileunyi Bandung Timur, Cileunyi, Bandung","Bandung, Cileunyi",840,200,5,4
1849,"1,9 M","Rumah Lux Harga Lelang di Arcamanik, Arcamanik, Bandung","Bandung, Arcamanik",230,300,5,4
1850,"1,75 M","Rumah Hoek Murah Arcamanik Bandung, Arcamanik, Bandung","Bandung, Arcamanik",249,190,5,4
1851,890000000,"Rumah Induk + Kost an di Taruna Sukaasih Bandung Timur, Bandung Wetan, Bandung","Bandung, Bandung Wetan",300,250,8,7
1852,850000000,"Rumah di Komp.Sukaasih Bandung Timur, Cicaheum, Bandung","Bandung, Cicaheum",320,220,7,5
1853,"2,6 M","Kost an Aktif di Kampus UPI Bandung Timur, Cibiru, Bandung","Bandung, Cibiru",322,600,30,24
1854,395000000,"Rumah Lux Minimalis di Ujungberung Bandung Timur, Ujungberung, Bandung","Bandung, Ujungberung",92,60,2,1
1855,450000000,"Rumah Lux Minimalis di Komp.Sukaasih Bandung Timur, Arcamanik, Bandung","Bandung, Arcamanik",80,38,2,1
1856,399000000,"Rumah Murah Kwalitas Wah Komp.Sukaasih Bandung Timur, Ujungberung, Bandung","Bandung, Ujungberung",66,36,2,1
1857,"2,9 M","Rumah Besar di Komp.Arcamanik Endah, Arcamanik, Bandung","Bandung, Arcamanik",300,300,7,5
1858,"2,6 M","Kost an Aktif di Kampus UPI Bandung Timur, Bandung Wetan, Bandung","Bandung, Bandung Wetan",322,600,30,24
1859,"1,75 M","Rumah Lux di Cijambe Ujungberung Bandung Timur, Ujungberung, Bandung","Bandung, Ujungberung",230,320,7,3
1860,"1,15 M","Rumah Anda di Komp.Arcamanik Endah, Arcamanik, Bandung","Bandung, Arcamanik",176,140,4,2
1861,585000000,"Rumah Murah Kwalitas Wah Komp.Sukaasih Bandung Timur, Ujungberung, Bandung","Bandung, Ujungberung",167,42,2,1
1862,"2,35 M","Rumah MEGAH Termurah di Bumi Panyawangan Bandung Timur, Cileunyi, Bandung","Bandung, Cileunyi",384,335,5,4
1863,"1,5 M","Rumah Lux Komp.Arcamanik Bandung TImur, Arcamanik, Bandung","Bandung, Arcamanik",140,175,5,4
1864,"2,45 M","Kost an Aktif di Arcamanik Bandung Timur, Arcamanik, Bandung","Bandung, Arcamanik",420,500,11,8
1865,"3,7 M","Bu Rumah Mewah N Megah Di Arcamanik, Arcamanik, Bandung","Bandung, Arcamanik",483,720,6,6
1866,850000000,"Rumah di Komp.Arcamanik Endah, Arcamanik, Bandung","Bandung, Arcamanik",110,150,3,2
1867,"1,85 M","Rumah Besar Di Arcamanik Bandung, Arcamanik, Bandung","Bandung, Arcamanik",401,380,5,5
1868,1 M,"Rumah Hoek di Bumi Panyawangan Bandung TImur, Bandung Wetan, Bandung","Bandung, Bandung Wetan",180,300,4,4
1869,1 M,"Rumah Hoek di Bumi Panyawangan Bandung TImur, Cileunyi, Bandung","Bandung, Cileunyi",180,300,4,4
1870,"41,763,000,000","Rumah 2 Kamar 65m2 - MV House, Pasir Jati, Bandung, Pasir Koja, Bandung","Bandung, Pasir Koja",87,65,2,1
1871,"82,208,000,000","Hunian Masa Kini 300 Meter Jl.A.H Nasution Bandung Timur, Cicaheum, Bandung","Bandung, Cicaheum",72,60,3,2
1872,"1,65 M","Rumah permanen di cluster margahayu bandung, Margahayu, Bandung","Bandung, Margahayu",127,200,4,3
1873,"1,3 M","rumah minimalis GRAHA MARS TOWN HOUSE  di Margahayu Raya Bandung, Margahayu, Bandung","Bandung, Margahayu",126,105,3,3
1874,"1,7 M","rumah minimalis cantik di cluster daerah margahayu bandung, Margahayu, Bandung","Bandung, Margahayu",206,200,5,4
1875,"1,65 M","Rumah Minimalis Cantik View gunung tengah kota di cluster Margahayu Raya Bandung, Margahayu, Bandung","Bandung, Margahayu",127,200,4,4
1876,"1,65 M","Rumah Minimalis Baru Nan Cantik di cluster Margahayu raya cocok Untuk kantor, Margahayu, Bandung","Bandung, Margahayu",127,200,3,4
1877,400000000,"rumah minimalis untuk keluarga kecil dicipadung cibiru dekat kampus universitas islam  negri bandung, Cibiru, Bandung","Bandung, Cibiru",84,36,2,1
1878,985000000,"Rumah Minimalis Baru Renovasi Di Manjahlega Saturnus Margahayu Raya, Margahayu, Bandung","Bandung, Margahayu",155,130,3,2
1879,"2,7 M","Ruko Cocok untuk usaha di Mainroad AH nasution Kawasan Rame dan Elit depan RS. Hermina, Arcamanik, Bandung","Bandung, Arcamanik",60,260,1,2
1880,825000000,"Rumah siap Huni belakang Terminal antapani, Antapani, Bandung","Bandung, Antapani",79,66,2,2
1881,570000000,"Rumah dekat pusat Kota harga masih sangat terjangkau di Bandung Timur Cicaheum, Jatihandap, Cicaheum, Bandung","Bandung, Cicaheum",72,36,2,1
1882,"6,5 M","cari rumah di arcamanik bandung BDG - 0206, Arcamanik, Bandung","Bandung, Arcamanik",500,375,3,2
1883,345000000,"Rumah murah,fkuster strategis, harga 300 jtan di ujung berung bandung timur, Ujungberung, Bandung","Bandung, Ujungberung",60,30,2,1
1884,345000000,"Rumah murah cantik,minimalis,strategis di ujung berung bandung timur, Ujungberung, Bandung","Bandung, Ujungberung",60,30,2,1
1885,457000000,"Rumah asri minimalis di ciwastra dekat gedebage Bandung timur, Ciwastra, Bandung","Bandung, Ciwastra",72,36,2,1
1886,526000000,"rumah di sindanglaya bandung, Perumahan Green Harmoni, Arcamanik, Bandung","Bandung, Arcamanik",90,36,2,1
1887,"1,1 M","Rumah asri sebelah carefour Kiaracondong bandung Timur, BKR, Bandung","Bandung, BKR",133,100,3,2
1888,930000000,"Rumah Modern 2 Lantai, Cipamokolan Riung Bandung, Rancasari Ciwastra, Bandung Timur, Rancasari, Bandung","Bandung, Rancasari",88,105,3,3
1889,650000000,"Rumah Modern Minimalis Cipamokolan, Rancasari Ciwastra, Bandung Timur, Rancasari, Bandung","Bandung, Rancasari",76,50,2,1
1890,695000000,"rumah minimalis 2 lantai di ujung berung, Ujungberung, Bandung","Bandung, Ujungberung",75,107,3,2
1891,650000000,"Rumah di Kinagara Residence Ciganitri Bandung Timur, Bojongsoang, Bandung","Bandung, Bojongsoang",150,70,2,2
1892,"1,85 M","RUMAH BESAR DI LINGKUNGAN KOMPLEK YANG ASRI  (Villa Bandung Indah, Cileunyi Kuon, Kab Bandung ), Cileunyi, Bandung","Bandung, Cileunyi",400,300,6,3
1893,"1,6 M","RUMAH KOKOH 2 LANTAI DI VILLA BANDUNG INDAH ( Cileunyi ), Cileunyi, Bandung","Bandung, Cileunyi",273,180,5,3
1894,795000000,"Rumah Baru Berkualitas Siap Huni di Arcamanik Cisaranten Kulon, Arcamanik, Bandung","Bandung, Arcamanik",133,70,2,1
1895,5 M,"Rumah di Martanegara Jln Pangkur III Bandung, Turangga, Bandung","Bandung, Turangga",291,170,4,2
1896,"1,9 M","Rumah Aman dan Nyaman di Komplek Riung Bandung, Gede Bage, Bandung","Bandung, Gede Bage",266,186,5,3
1897,540000000,"Rumah Baru Berkualitas Siap Huni di Antapani Jln Kalijati, Antapani, Bandung","Bandung, Antapani",74,45,2,1
1898,"1,1 M","Rumah di Komplek Bumi Panyileukan, Soekarno Hatta, Bandung, Cibiru, Bandung","Bandung, Cibiru",117,170,3,2
1899,"1,4 M","Rumah di Cisaranten Kulon Arcamanik, Arcamanik, Bandung","Bandung, Arcamanik",150,136,3,3
1900,"1,2 M","Rumah di Cingised Kav Pindad, Cisaranten Kulon Arcamanik, Arcamanik, Bandung","Bandung, Arcamanik",126,90,3,3
1901,2 M,"rumah dengan tanah cukup luas di pinggir jalan cijawura ciwastra, Ciwastra, Bandung","Bandung, Ciwastra",376,150,4,2
1902,"2,3 M","Rumah Cocok Untuk Guesthouse di Ujungberung Bandung Timur, Ujungberung, Bandung","Bandung, Ujungberung",1207,152,6,4
1903,750000000,"rumah furnish dan toko/tempat usaha+barang dagangan di griya kuning asri ciwastra, bandung timur, Ciwastra, Bandung","Bandung, Ciwastra",78,120,3,1
1904,549000000,"RUMAH MURAH BARU CILENGKRANG VILLA&#39;S HOUSE, Cilengkrang, Bandung","Bandung, Cilengkrang",110,54,3,1
1905,"1,65 M","RUMAH DI VILLA BANDUNG INDAH (Cileunyi), Cileunyi, Bandung","Bandung, Cileunyi",273,180,5,3
1906,"4,3 M","rumah minimalist dalam cluster di dataran tinggi bukit ligar bandung, Cigadung, Bandung","Bandung, Cigadung",258,450,6,4
1907,650000000,"Rumah di Graha Ciganitri, Buahbatu, Buah Batu, Bandung","Bandung, Buah Batu",115,100,3,2
1908,650000000,"Rumah di Graha Ciganitri, Buahbatu, Bandung Timur, Buah Batu, Bandung","Bandung, Buah Batu",115,100,3,2
1909,975000000,"rumah di komplek elite green sharon residence, Soekarno Hatta, Bandung","Bandung, Soekarno Hatta",130,55,2,1
1910,5 M,"Rumah Besar Aman dan Nyaman di Antapani Bandung, Antapani, Bandung","Bandung, Antapani",340,520,6,6
1911,"1,1 M","Rumah di Komplek Bumi Panyileukan, Soekarno Hatta, Soekarno Hatta, Bandung","Bandung, Soekarno Hatta",117,170,3,2
1912,650000000,"Rumah di Graha Ciganitri, Buahbatu, Bandung Timur, Buah Batu, Bandung","Bandung, Buah Batu",115,100,3,2
1913,750000000,"rumah second sudah direnovasi siap huni di ciwastra bandung, Ciwastra, Bandung","Bandung, Ciwastra",142,100,4,2
1914,900000000,"rumah second siap huni aman dan nyaman di ciwastra bandung, Ciwastra, Bandung","Bandung, Ciwastra",180,144,3,2
1915,650000000,"rumah murah strategis di bandung timur kiaracondong, Kiaracondong, Bandung","Bandung, Kiaracondong",72,48,2,1
1916,650000000,"Rumah di Sukagalih Neglasari Bandung Timur, Ujungberung, Bandung","Bandung, Ujungberung",123,140,4,2
1917,"1,25 M","rumah di bandung timur, riung bandung, Rancasari, Bandung","Bandung, Rancasari",289,150,3,2
1918,721000000,"Rumah di Ciwastra Komplek Elit Bandung Timur, Ciwastra, Bandung","Bandung, Ciwastra",105,49,2,1
1919,670000000,"Rumah di Cimuncang Bandung, Padasuka, Bandung","Bandung, Padasuka",241,84,3,2
1920,"1,5 M","ESTERN HILL CIPADUNG BANDUNG TIMUR 1,5M, Cibiru, Bandung","Bandung, Cibiru",224,120,3,3
1921,"1,2 M","Rumah Cantik di Bandung Timur, Ujungberung, Bandung","Bandung, Ujungberung",95,170,4,4
1922,"1,5 M","Rumah nyaman aman dan siap huni  Sindangjaya Arcamanik Kota Bandung, Arcamanik, Bandung","Bandung, Arcamanik",99,220,4,3
1923,"1,75 M","Rumah ASRI di Komplek Sukup Ujung Berung, Ujungberung, Bandung","Bandung, Ujungberung",328,182,3,2
1924,665000000,"rumah minimalis harga murah 2 lantai di ujung berung bandung, Ujungberung, Bandung","Bandung, Ujungberung",75,107,3,2
1925,355000000,"rumah murah 2 lantai di ujungberung, Ujungberung, Bandung","Bandung, Ujungberung",60,85,4,2
1926,"2,25 M","Rumah ASRI di Komplek Sukup Ujung Berung, Ujungberung, Bandung","Bandung, Ujungberung",328,182,3,2
1927,"9,499,000,000","Rumah posisi hook di komplek Bahagia Permai Margacinta Buahbatu Bandung Timur,, Margacinta, Bandung","Bandung, Margacinta",180,100,2,1
1928,"2,91 M","Rumah Mewah 2 Lt Murah di Cluster Magnolia Grand Sharon Residen, Batujajar, Bandung Barat","Bandung Barat, Batujajar",175,225,5,4
1929,700000000,"Rumah Murah Di Bandung Timur, Kopo, Bandung","Bandung, Kopo",70,42,1,1
1930,882000000,"Rumah 2lt DP ringan, Bonus Kitchen Set, Electric Gate di Cicaheum dekat Cicadas Antapani Cikutra, Cicaheum, Bandung","Bandung, Cicaheum",72,60,3,2
1931,758000000,"Rumah di Margahayu, dekat Metro, RS Al Islam, dan Kawasan Niaga, Margahayu, Bandung","Bandung, Margahayu",81,45,2,1
1932,550000000,"Rumah DP Murah Cicilan Ringan di Cilengkrang Bandung Timur, Ujungberung, Bandung","Bandung, Ujungberung",72,36,2,1
1933,133000000,"Rumah Siap Huni Take Over di Cilengkrang Bandung Timur dekat Transmart, Ujungberung, Bandung","Bandung, Ujungberung",72,40,2,1
1934,"1,7 M","Rumah Cantik Cluster Margacinta Ciwastra Margahayu Bandung Timur, Ciwastra, Bandung","Bandung, Ciwastra",160,135,4,3
1935,"1,98 M","Rumah Adem Lingkungan nyaman, antapani arcamanik bandung timur, Antapani, Bandung","Bandung, Antapani",135,200,4,3
1936,"2,85 M","Rumah Unik Murah Antapani Bandung Timur, Antapani, Bandung","Bandung, Antapani",230,300,4,3
1937,950000000,"Rumah Murah Arcamanik Bandung Timur Antapani, Arcamanik, Bandung","Bandung, Arcamanik",176,100,4,3
1938,"1,5 M","Rumah Murah Mainroad Antapani Bandung Timur, Antapani, Bandung","Bandung, Antapani",100,150,5,1
1939,"1,1 M","Rumah Siap Huni Arcamanik Bandung Timur Lingkungan Aman Nyaman, Arcamanik, Bandung","Bandung, Arcamanik",176,140,3,2
1940,"1,25 M","Rumah Cantik Arcamanik Bandung Timur, Arcamanik, Bandung","Bandung, Arcamanik",176,140,3,2
1941,"1,15 M","Rumah Asri Arcamanik Cisaranten Bandung Timur, Arcamanik, Bandung","Bandung, Arcamanik",200,200,4,2
1942,450000000,"Rumah di cileunyi bandung timur, Cileunyi, Bandung","Bandung, Cileunyi",72,40,2,1
1943,"1,3 M","Rumah Hook Mewah Di Cibiru Bandung Timur, Cibiru, Bandung","Bandung, Cibiru",200,450,3,2
1944,526000000,"rumah murah daerah arcamanik bandung, daerah sindanglaya, Arcamanik, Bandung","Bandung, Arcamanik",90,36,2,1
1945,"1,2 M","Rumah Nyaman sekitar Antapani,Bandung Timur, Antapani, Bandung","Bandung, Antapani",160,180,4,3
1946,"1,2 M","Rumah cantik harga menarik sekitar Antapani, Antapani, Bandung","Bandung, Antapani",198,170,4,3
1947,"1,35 M","Rumah asri di kota Bandung Ciwastra, Ciwastra, Bandung","Bandung, Ciwastra",220,160,3,3
1948,"1,6 M","Rumah Megah Area Bandung Timur, Antapani, Antapani, Bandung","Bandung, Antapani",180,300,7,3
1949,700000000,"Rumah baru super mewah mulai dari 700 jt an.grand Sharon kota bandung, Bandung Kota, Bandung","Bandung, Bandung Kota",72,42,2,1
1950,680000000,"Rumah 2 Lantai Hook Strategis Ujung Berung Neglasari, Ujungberung, Bandung","Bandung, Ujungberung",103,103,4,2
1951,468000000,"Rumah murah,Cantik,minimalis.strategis di ujung berung,Cilengkrang,sindanglaya bandung timur, Ujungberung, Bandung","Bandung, Ujungberung",65,36,2,1
1952,625000000,"Rumah Di Antapani Bandung, Antapani, Bandung","Bandung, Antapani",60,90,2,1
1953,450000000,"Rumah Nyaman &amp; Unik GBI Bandung, Bojongsoang, Bandung","Bandung, Bojongsoang",75,60,2,2
1954,330000000,"Rumah Bumi Panyileukan Murah, Gede Bage, Bandung","Bandung, Gede Bage",60,45,2,1
1955,450000000,"Rumah Baru Cocok u/ Keluarga Muda Riung Bandung, Gede Bage, Bandung","Bandung, Gede Bage",77,36,1,1
1956,415000000,"CEPAAAAT....Rumah minimalis baru dan murah di Bumi Panyileukan Cibiru bandung, Cibiru, Bandung","Bandung, Cibiru",66,45,2,1
1957,"73,116,000,000","rumah di bandung timur murah, grand sharon siap huni, Rancasari, Bandung","Bandung, Rancasari",72,42,2,1
1958,"3,5 M","rumah di daerah cigadung, bandung timur lokasi strategis, Cibeunying, Bandung","Bandung, Cibeunying",190,200,7,7
1959,495000000,"TURUN HARGA....Rumah minimalis di bumi panyawangan bandung, bonus TV baru..., Cileunyi, Bandung","Bandung, Cileunyi",90,50,2,1
1960,425000000,"Perumahan Syariah Dekat ITB Jatinangor, Jatinangor, Bandung","Bandung, Jatinangor",140,50,2,2
1961,526000000,"rumah daerah arcamanik bandung, rumah cluster green harmoni, Arcamanik, Bandung","Bandung, Arcamanik",90,36,2,1
1962,"1,2 M","GAYA TOWN HILLS, Arcamanik, Bandung","Bandung, Arcamanik",230,80,3,2
1963,"73,116,000,000","rumah grand sharon, dp 0% di bandung timur, Rancasari, Bandung","Bandung, Rancasari",72,42,2,1
1964,"3,5 M","rumah daerah cigadung, rumah mewah bandung timur, Cibeunying, Bandung","Bandung, Cibeunying",190,200,7,7
1965,388000000,"Rumah minimalis siap huni di Cipadung, Bandung Kota, Bandung","Bandung, Bandung Kota",62,36,2,1
1966,1 M,"Rumah Minimalis Full Furnished Beserta isi-isinya, Cibiru, Bandung","Bandung, Cibiru",238,250,4,3
1967,1 M,"Rumah Modern Murah Beserta isi-isinya, Cibiru, Bandung","Bandung, Cibiru",238,250,4,3
1968,900000000,"Rumah minimalis posisi hook cocok untuk usaha di Bandung Timur, Bandung Kota, Bandung","Bandung, Bandung Kota",138,150,3,2
1969,900000000,"Rumah hook cocok untuk usaha bandung timur, Bandung Kota, Bandung","Bandung, Bandung Kota",138,150,3,2
1970,900000000,"Rumah cluster lux minimalis dan berdesain unik di bandung timur, Ujungberung, Bandung","Bandung, Ujungberung",143,80,3,2
1971,900000000,"Rumah mewah bisa dijadikan hunian pribadi atau tempat usaha, Ujungberung, Bandung","Bandung, Ujungberung",143,80,3,2
1972,600000000,"Rumah Murah, Strategis, dan Bebas Banjir di Bandung Timur, Antapani, Bandung","Bandung, Antapani",126,90,2,2
1973,900000000,"Rumah mewah siapa cepat dia dapat makin di tunda makin mahal, Ujungberung, Bandung","Bandung, Ujungberung",143,80,3,2
1974,"1,2 M","Rumah hunian suasana pegunungan, Bandung Kota, Bandung","Bandung, Bandung Kota",233,80,3,2
1975,900000000,"Rumah 2 lantai dalam cluster bandung timur, Cileunyi, Bandung","Bandung, Cileunyi",105,170,5,3
1976,900000000,"Rumah modern minimalis bandung timur, Cibiru, Bandung","Bandung, Cibiru",250,238,4,3
1977,1 M,"Rumah cantik nan elegan spesifikasi menakjukan, Cileunyi, Bandung","Bandung, Cileunyi",191,100,3,2
1978,750000000,"Rumah Ornamen Kayu Jati Bandung Timur, Cibiru, Bandung","Bandung, Cibiru",100,200,4,3
1979,388000000,"Rumah minimalis siap huni di Cipadung, Bandung Kota, Bandung","Bandung, Bandung Kota",62,36,2,1
1980,900000000,"Rumah minimalis posisi hook cocok untuk usaha Bandung Timur, Bandung Kota, Bandung","Bandung, Bandung Kota",138,150,3,2
1981,900000000,"rumah mewah siapa cepat dia dapat makin di tunda makin mahal, Ujungberung, Bandung","Bandung, Ujungberung",143,80,3,2
1982,750000000,"Rumah Bagus,,Strategis,,Rapi &amp; Nyaman Terbaik Di Kawasan Bandung Timur, Cibiru, Bandung","Bandung, Cibiru",101,200,4,3
1983,900000000,"Rumah cluster lux minimalis dan berdesain unik di bandung timur, Ujungberung, Bandung","Bandung, Ujungberung",143,80,3,2
1984,900000000,"Rumah hook cocok untuk usaha bandung timur, Bandung Wetan, Bandung","Bandung, Bandung Wetan",138,150,3,2
1985,"1,2 M","Rumah hunian pegunungan, Bandung Kota, Bandung","Bandung, Bandung Kota",233,80,3,2
1986,900000000,"Rumah mewah bisa dijadikan hunian pribadi atau tempat usaha, Ujungberung, Bandung","Bandung, Ujungberung",143,80,3,2
1987,900000000,"Rumah 2 lantai dalam cluster bandung timur, Cileunyi, Bandung","Bandung, Cileunyi",105,170,5,3
1988,1 M,"Rumah modern minimalis bandung timur, Cibiru, Bandung","Bandung, Cibiru",238,250,4,3
1989,1 M,"Rumah cantik nan elegan spesifikasi menakjubkan, Cileunyi, Bandung","Bandung, Cileunyi",191,100,3,2
1990,410000000,"Rumah Cantik Minimalis Di perumahan Griya Asri Ujung Berung Bandung Timur, Ujungberung, Bandung","Bandung, Ujungberung",72,36,2,1
1991,830000000,"Rumah Cantik Dalam Komplek Mewah Bandung Timur, Margahayu, Bandung","Bandung, Margahayu",86,70,3,2
1992,750000000,"Rumah Besar Air Bagus, Cileunyi, Bandung","Bandung, Cileunyi",101,200,4,3
1993,"1,1 M","Rumah Istimewa Strategis Bandung Timur, Buah Batu, Bandung","Bandung, Buah Batu",102,140,4,2
1994,388000000,"Rumah minimalis siap huni di Cipadung, Bandung Kota, Bandung","Bandung, Bandung Kota",62,36,2,1
1995,900000000,"Rumah minimalis posisi hook cocok untuk usaha Bandung Timur, Bandung Kota, Bandung","Bandung, Bandung Kota",138,150,3,2
1996,900000000,"Rumah hook cocok untuk usaha di bandung timur, Bandung Kota, Bandung","Bandung, Bandung Kota",138,150,3,2
1997,900000000,"Rumah mewah siapa cepat dia dapat makin di tunda makin mahal, Ujungberung, Bandung","Bandung, Ujungberung",143,80,3,2
1998,900000000,"Rumah mewah bisa di jadikan hunian pribadi atau tempat usaha, Ujungberung, Bandung","Bandung, Ujungberung",143,80,3,2
1999,900000000,"Rumah cluster lux minimalis dan berdesain unik di bandung timur, Ujungberung, Bandung","Bandung, Ujungberung",143,80,3,2
2000,"1,2 M","rumah hunian pegunungan, Bandung Kota, Bandung","Bandung, Bandung Kota",233,80,3,2
2001,900000000,"Rumah 2 lantai dalam cluster bandung timur, Cileunyi, Bandung","Bandung, Cileunyi",105,170,5,3
2002,1 M,"Rumah cantik nan elegan spesifikasi menakjubkan, Cileunyi, Bandung","Bandung, Cileunyi",191,100,3,2
2003,850000000,"Rmh murah,Baru,2 lantai di Metro, Margahayu, Bandung","Bandung, Margahayu",72,90,3,2
2004,526000000,"rumah di arcamanik bandung, bersistem cluster 500 jutaan, Arcamanik, Bandung","Bandung, Arcamanik",90,36,2,1
2005,"2,5 M","* Rumah sangat nyaman dan bersih di dekat pusat kota, Cigadung cikutra tubagus ismail dago *, Cigadung, Bandung","Bandung, Cigadung",157,200,4,3
2006,550000000,"RUMAH @ PERMATA RANCASAWO* *MARGAHAYU* BANDUNG*, Margahayu, Bandung","Bandung, Margahayu",90,84,2,1
2007,550000000,"* rumah (harga di bawah pasar) Rumah baru strategis di Bandung Timur, terletak di daerah margahayu bandung *, Margahayu, Bandung","Bandung, Margahayu",80,60,2,1
2008,"3,645,000,000","Rumah Syariah 2 Lantai Bandung Timur View Cantik Kota Bandung, Ujungberung, Bandung","Bandung, Ujungberung",76,54,3,2
2009,320000000,"Rumah Syariah Dua lantai di Bandung Timur Ujungberung, Ujungberung, Bandung","Bandung, Ujungberung",70,45,3,1
2010,600000000,"Rumah siap huni dalam cluster di Acamanik, Arcamanik, Bandung","Bandung, Arcamanik",95,70,2,1
2011,995000000,"Rumah Baru Minimalis Siap Huni - Panyileukan - Bandung Timur, Soekarno Hatta, Bandung","Bandung, Soekarno Hatta",90,140,3,2
2012,500000000,"Rumah murah,2 lantai,strategis di ujung berung,cilengkrang,cibiru bandung timur, Ujungberung, Bandung","Bandung, Ujungberung",65,65,4,2
2013,"73,116,000,000","rumah di grand sharon, dp 0% perumahan bandung timur, Rancasari, Bandung","Bandung, Rancasari",72,42,2,1
2014,883000000,"Investasi dan Hunian Strategis dekat Tol Buah Batu 2 Lantai DP Mulai 50 Juta, Bojongsoang, Bandung","Bandung, Bojongsoang",107,62,3,2
2015,"1,15 M","Rumah Di Pinus Regency Soekarno Hatta, Soekarno Hatta, Bandung","Bandung, Soekarno Hatta",168,170,3,2
2016,"2,8 M","Rumah Lama Terawat Dan Bagus, Ujungberung, Bandung","Bandung, Ujungberung",225,450,5,3
2017,750000000,"Rumah terawat siap huni  lokasi strategis di cisaranteun arcamanik, Arcamanik, Bandung","Bandung, Arcamanik",108,60,2,1
2018,822000000,"TELAH DIBUKA CLUSTER FONTANA  &#34;SMART LIVING, SMART INVESTMENT&#34; di CITY GARDEN RESIDENCE CICAHEUM, Mandalajati, Bandung","Bandung, Mandalajati",72,60,3,2
2019,"4,925,000,000","Rumah Murah Lokasi Sunrise di Gedebage Bandung Timur, Gede Bage, Bandung","Bandung, Gede Bage",72,41,2,1
2020,526000000,"rumah di arcamanik, hanya 5 menit ke jalan utama, Arcamanik, Bandung","Bandung, Arcamanik",90,36,2,1
2021,"1,2 M","Rumah Cluster Exclusive Bandung Timur, Bandung Wetan, Bandung","Bandung, Bandung Wetan",108,100,2,2
2022,526000000,"rumah murah di arcamanik, perumahan cluster, Arcamanik, Bandung","Bandung, Arcamanik",90,36,2,1
2023,990000000,"Rumah siap huni di Lokasi strategis di baypas Bandung, Soekarno Hatta, Bandung","Bandung, Soekarno Hatta",120,100,4,2
2024,875000000,"rumah asri nan cantik si bandung timur, Gede Bage, Bandung","Bandung, Gede Bage",100,112,3,2
2025,695000000,"rumah cantik dan asri di bandung timur, Gede Bage, Bandung","Bandung, Gede Bage",144,90,3,1
2026,"69,883,000,000","Info Rumah di Bandung Timur DP 25 JUTA SAJA, Ciwastra, Bandung","Bandung, Ciwastra",90,40,2,1
2027,"69,883,000,000","KPR Perumahan Baru Bandung Timur DP 25 JUTA SAJA, Ciwastra, Bandung","Bandung, Ciwastra",90,40,2,1
2028,"69,883,000,000","Rumah KPR Daerah Bandung Timur DP 25 JUTA SAJA, Ciwastra, Bandung","Bandung, Ciwastra",90,40,2,1
2029,"69,883,000,000","KPR Rumah di Bandung Timur DP 25 JUTA SAJA, Ciwastra, Bandung","Bandung, Ciwastra",90,40,2,1
2030,"69,883,000,000","KPR Perumahan Bandung Timur DP 25 JUTA SAJA, Ciwastra, Bandung","Bandung, Ciwastra",90,40,2,1
2031,"69,883,000,000","Kredit Perumahan di Bandung Timur DP 25 JUTA SAJA, Ciwastra, Bandung","Bandung, Ciwastra",90,40,2,1
2032,"69,883,000,000","Kredit Rumah KPR di Bandung Timur DP 25 JUTA SAJA, Ciwastra, Bandung","Bandung, Ciwastra",90,40,2,1
2033,"69,883,000,000","Kredit Rumah Daerah Bandung Timur DP 25 JUTA SAJA, Ciwastra, Bandung","Bandung, Ciwastra",90,40,2,1
2034,"69,883,000,000","Kredit Perumahan Bandung Timur DP 25 JUTA SAJA, Ciwastra, Bandung","Bandung, Ciwastra",90,40,2,1
2035,"69,883,000,000","Kredit Rumah Daerah Bandung Timur DP 25 JUTA SAJA, Ciwastra, Bandung","Bandung, Ciwastra",90,40,2,1
2036,"69,883,000,000","Kredit Perumahan Bandung Timur DP 25 JUTA SAJA, Ciwastra, Bandung","Bandung, Ciwastra",90,40,2,1
2037,"69,883,000,000","Harga Rumah di Ciwastra Bandung DP 25 JUTA SAJA, Ciwastra, Bandung","Bandung, Ciwastra",90,40,2,1
2038,"69,883,000,000","Kredit Rumah di Ciwastra DP 25 JUTA SAJA, Ciwastra, Bandung","Bandung, Ciwastra",90,40,2,1
2039,"69,883,000,000","Perumahan KPR Ciwastra DP 25 JUTA SAJA, Ciwastra, Bandung","Bandung, Ciwastra",90,40,2,1
2040,"69,883,000,000","Rumah di Daerah Ciwastra Bandung DP 25 JUTA SAJA, Ciwastra, Bandung","Bandung, Ciwastra",90,40,2,1
2041,850000000,"Rumah Cantik Asri Minimalis, Soekarno Hatta, Bandung","Bandung, Soekarno Hatta",107,70,2,2
2042,"1,15 M","Komplek Istana Kawaluyaan Soekarno Hatta, Soekarno Hatta, Bandung","Bandung, Soekarno Hatta",184,170,3,2
2043,526000000,"rumah di daerah arcamanik bandung, perumahan cluster, Arcamanik, Bandung","Bandung, Arcamanik",90,36,2,2
2044,800000000,"Rumah Siap Huni Di Griya Kuning Asri Ciwastra Bandung Timur, Ciwastra, Bandung","Bandung, Ciwastra",135,80,3,2
2045,650000000,"Rumah Siap Huni di Kinagara Residence Ciganitri Buahbatu, Buah Batu, Bandung","Bandung, Buah Batu",91,60,2,1
2046,975000000,"Rumah Hook di Bahagia Permai Buahbatu Bandung, Buah Batu, Bandung","Bandung, Buah Batu",115,130,4,2
2047,325000000,"Rumah murah,minimalis,strategis di ujung berung bandung timur, Ujungberung, Bandung","Bandung, Ujungberung",60,36,2,1
2048,550000000,"Rumah baru cisaranten, Arcamanik, Bandung","Bandung, Arcamanik",90,51,2,1
2049,550000000,"Rumah asri dan terawat di komp bumi panyawangan cileunyi bandung, Cileunyi, Bandung","Bandung, Cileunyi",105,90,2,1
2050,555000000,"Perumahan bandung timur Dp rendah, Bandung Kota, Bandung","Bandung, Bandung Kota",80,42,2,1
2051,526000000,"rumah di sindanglaya bandung, Perumahan Green Harmoni, Arcamanik, Bandung","Bandung, Arcamanik",90,36,2,1
2052,650000000,"kinagara regency ciganitri, Bojongsoang, Bandung","Bandung, Bojongsoang",131,120,2,1
